{
  "farhp_weblab_utterance_version": "0.5",
  "generated_at": "2026-07-27T03:26:14.343Z",
  "sample_rate_hz": 24000,
  "text": "你好嗎",
  "sentence_type": "question",
  "lexical_bopomofo": [
    "ㄋㄧˇ",
    "ㄏㄠˇ",
    "˙ㄇㄚ"
  ],
  "surface_bopomofo": [
    "ㄋㄧˊ",
    "ㄏㄠˇ",
    "˙ㄇㄚ"
  ],
  "rules": {
    "third_tone_sandhi": true,
    "yi_bu_sandhi": true,
    "neutral_tone_context": true,
    "prosodic_grouping": true,
    "coarticulation_crossfade": true,
    "formant_parameter_interpolation": true,
    "phrase_declination": true,
    "sentence_intonation": "question",
    "intonation_strength": 1,
    "speech_rate": 1,
    "boundary_overlap_ms": 32,
    "group_pause_ms": 90,
    "final_lengthening": 0.18
  },
  "prosodic_groups": [],
  "syllables": [
    {
      "index": 0,
      "character": "你",
      "initial": "ㄋ",
      "final": "i",
      "lexical_tone": 3,
      "surface_tone": 2,
      "lexical_bopomofo": "ㄋㄧˇ",
      "surface_bopomofo": "ㄋㄧˊ",
      "sandhi_applied": true,
      "sandhi_types": [
        "三聲變調"
      ],
      "third_tone_sandhi": true,
      "yi_bu_sandhi": false,
      "prosodic_group": 0,
      "boundary_after": false,
      "contextual_neutral": false,
      "previous_surface_tone": null,
      "base_f0_hz": 132,
      "duration_sec": 0.78,
      "sentence_intonation_semitones": {
        "start": 0,
        "end": 0
      },
      "vocal_tract_context": {
        "left_vowel": null,
        "right_vowel": "a",
        "interpolation_strength": 0.62
      },
      "farhp": {
        "source": "lab",
        "strength": 1
      },
      "boundary": {
        "index": 0,
        "start_sample": 0,
        "end_sample": 18720,
        "overlap_samples": 0,
        "pause_before_samples": 0
      }
    },
    {
      "index": 1,
      "character": "好",
      "initial": "ㄏ",
      "final": "ao",
      "lexical_tone": 3,
      "surface_tone": 3,
      "lexical_bopomofo": "ㄏㄠˇ",
      "surface_bopomofo": "ㄏㄠˇ",
      "sandhi_applied": false,
      "sandhi_types": [],
      "third_tone_sandhi": false,
      "yi_bu_sandhi": false,
      "prosodic_group": 0,
      "boundary_after": false,
      "contextual_neutral": false,
      "previous_surface_tone": null,
      "base_f0_hz": 125.31315996546853,
      "duration_sec": 0.78,
      "sentence_intonation_semitones": {
        "start": 0,
        "end": 0.7
      },
      "vocal_tract_context": {
        "left_vowel": "i",
        "right_vowel": "a",
        "interpolation_strength": 0.62
      },
      "farhp": {
        "source": "lab",
        "strength": 1
      },
      "boundary": {
        "index": 1,
        "start_sample": 17952,
        "end_sample": 36672,
        "overlap_samples": 768,
        "pause_before_samples": 0
      }
    },
    {
      "index": 2,
      "character": "嗎",
      "initial": "ㄇ",
      "final": "a",
      "lexical_tone": 0,
      "surface_tone": 0,
      "lexical_bopomofo": "˙ㄇㄚ",
      "surface_bopomofo": "˙ㄇㄚ",
      "sandhi_applied": false,
      "sandhi_types": [],
      "third_tone_sandhi": false,
      "yi_bu_sandhi": false,
      "prosodic_group": 0,
      "boundary_after": false,
      "contextual_neutral": true,
      "previous_surface_tone": 3,
      "base_f0_hz": 118.96506106462958,
      "duration_sec": 0.52,
      "sentence_intonation_semitones": {
        "start": 0.4,
        "end": 4.8
      },
      "vocal_tract_context": {
        "left_vowel": "o",
        "right_vowel": null,
        "interpolation_strength": 0.62
      },
      "farhp": {
        "source": "lab",
        "strength": 1
      },
      "boundary": {
        "index": 2,
        "start_sample": 35904,
        "end_sample": 44390,
        "overlap_samples": 768,
        "pause_before_samples": 0
      }
    }
  ],
  "acoustics": {
    "duration_sec": 1.8495833333333334,
    "f0_min_hz": 90.74819946289062,
    "f0_max_hz": 177.80531311035156,
    "raw_peak": 0.800000011920929
  },
  "decomposition": "lexical phonology -> prosodic grouping -> tone sandhi -> contextual neutral tone -> phrase/sentence intonation -> vocal-tract interpolation -> syllable FARHP -> boundary rendering",
  "warning": "MVP prosody and formant-interpolation model; not a natural-speech TTS or full syntactic/physiological parser"
}